{
  "schemaVersion": "1.0",
  "documentType": "wave-amendment-approval",
  "amendmentId": "W2.A06",
  "changeRequestId": "ECR-0014",
  "targetWave": "W2",
  "status": "APPROVED",
  "approvedBy": "human:repository-owner",
  "approvedAt": "2026-10-11T13:27:13.517641+00:00",
  "decision": "The repository owner answered 'Approved, please continue' to the exact complete ECR-0014/W2.A06 batch request identifying candidate ac6b664a2ced6b2263ff7b5ab48535c3f39798ce, packet SHA-256 6293590db74b9a3ec4ce6019a1713def568798ac3a71208a5583bfcff78f7a34 and independent R01 ledger a31e42a11fcd1b7eaf52639f174f7885e2d08d49f5ec1a3a8099bdc1ac3e7193 at 87e44188dbb0e54039f8b77d3613ed2728bcd51b. This single grant binds the complete reviewed three ordered recovery/verification tasks, narrow durable current-user and same-machine ownership witness, exact 45 AST plus 3 literal finite method contracts, exact Reader CSP predicate, unchanged one-file formatter-debt disposition, complete quality data inventory, conditional original-fixture recovery only when actual evidence authenticates, the exact current W2.C18.T01 method packet and bounded pre-admission/final source and evidence recording. Conforming details inside these exact contracts require no second owner answer. W1 restoration in W2 is already authorized. Actual C18 completion and quiescence precede B00 submission, review, exact materialization and activation; every admitted task still requires claim, implementation, actual checks, independent disposition and normal integration. All original approvals, adverse findings and immutable evidence remain preserved. No additional framework development, unknown predicate or scope exemption, 8/16GiB variant, task/Slice/Wave completion or W2 release approval is granted. This timestamp records binding of the actual answer, not an invented message timestamp.",
  "packet": {
    "commit": "ac6b664a2ced6b2263ff7b5ab48535c3f39798ce",
    "path": "planning/enabler-change-requests/ECR-0014.packet.json",
    "sha256": "6293590db74b9a3ec4ce6019a1713def568798ac3a71208a5583bfcff78f7a34",
    "proposalPath": "planning/enabler-change-requests/ECR-0014.md",
    "proposalSha256": "7c70aeebc5a60ab606bd5f6170b48e2012becab8cf7547f7ad8cd75482291496"
  },
  "effectiveBase": {
    "waveBase": {
      "waveId": "W2",
      "packetCommit": "c85a59f3a293f8e3f2eaf6454682c9a14b1efa55",
      "approvalRecordCommit": "3bc1c1828efab50efc730bf3907c3036eff58a2f"
    },
    "orderedAmendments": [
      {
        "id": "W2.A01",
        "changeRequestId": "ECR-0009",
        "status": "ADOPTED",
        "packetCommit": "3fb76d6cb6bce6eaf16774931704de68c6168500",
        "approvalReference": {
          "path": "planning/wave-amendment-approvals/W2.A01.json",
          "sha256": "6fe58c9791d224a51367f42ced40e27a45a0d83ee07464e237fc2a302edc4096",
          "introductionCommit": "f8a49a2ec7ff4daf6e1c5e14da369e06ddff5287"
        },
        "effectiveStateCommit": "56187d40ca5d38f72f7c9dfb132070b034032a57"
      },
      {
        "id": "W2.A02",
        "changeRequestId": "ECR-0010",
        "status": "ADOPTED",
        "packetCommit": "60e8a2d3bbd3ba50cc4809a7ebe799764e6b00db",
        "approvalReference": {
          "path": "planning/wave-amendment-approvals/W2.A02.json",
          "sha256": "d99be15aa110248b0e10e7090210787fe5cfa8e929e759f91a7d84a8e57a8d79",
          "introductionCommit": "5fbeea66e84bac5ab24cf1bb8d2522838529a0ba"
        },
        "effectiveStateCommit": "04d6ae3fb29a133e6e31c8191ba1d6b80fa0b0cf"
      },
      {
        "id": "W2.A03",
        "changeRequestId": "ECR-0011",
        "status": "ADOPTED",
        "packetCommit": "746c05dcd7dbabaa7f5eebee8e3fa56b8ac6b9b5",
        "approvalReference": {
          "path": "planning/wave-amendment-approvals/W2.A03.json",
          "sha256": "8852d6631a6656e94cc75e4f9dc705c7095ecf111786748e5630fe13b8fa9087",
          "introductionCommit": "c972e2116113afa7ad84f0e43bdad58660cc69bb"
        },
        "effectiveStateCommit": "0b20d78426a053ea3818089d7126c123c0be7a65"
      },
      {
        "id": "W2.A04",
        "changeRequestId": "ECR-0012",
        "status": "ADOPTED",
        "packetCommit": "7f35c7a8e49eb8415ffdffa5a2e04374161f0eae",
        "approvalReference": {
          "path": "planning/wave-amendment-approvals/W2.A04.json",
          "sha256": "e769cb71efbf8725c0fadeac079713f4484f57f7cf871cdfb037ef9a4df27807",
          "introductionCommit": "ba95f68bd2747ebce99e67eeb4daec53ed3ba87b"
        },
        "effectiveStateCommit": "8f1a47f8a334fe32330e75f637f9b71b83669a03"
      },
      {
        "id": "W2.A05",
        "changeRequestId": "ECR-0013",
        "status": "ADOPTED",
        "packetCommit": "55c6389ce39a656f4da3851cae32ae12ac80e796",
        "approvalReference": {
          "path": "planning/wave-amendment-approvals/W2.A05.json",
          "sha256": "9ad5b3f5fca7d3fd9c7fd8a42200f570f46250d506765b30e2705e299c7e8101",
          "introductionCommit": "b54f24c222f631700056574a08056f660696d305"
        },
        "effectiveStateCommit": "79556040fff511246a6a4cc6d9858254f8713911"
      }
    ],
    "reservedAmendments": []
  },
  "bootstrapUnit": "W2.A06.B00",
  "authorizedTaskIds": [
    "W2.A06.T01",
    "W2.A06.T02",
    "W2.A06.T03"
  ],
  "independentPacketReview": {
    "reviewer": "agent:/root/a03_closeout_review",
    "candidateCommit": "ac6b664a2ced6b2263ff7b5ab48535c3f39798ce",
    "reviewedStateCommit": "87e44188dbb0e54039f8b77d3613ed2728bcd51b",
    "result": "APPROVED",
    "attemptId": "R01",
    "findingIdsClosed": [
      "W2.remaining-corrections-batch-R01-F01",
      "W2.remaining-corrections-batch-R01-F02",
      "W2.remaining-corrections-batch-R01-F03",
      "W2.remaining-corrections-batch-R01-F04"
    ],
    "ledger": {
      "path": "planning/enabler-change-requests/ECR-0014.review-R01.json",
      "sha256": "a31e42a11fcd1b7eaf52639f174f7885e2d08d49f5ec1a3a8099bdc1ac3e7193",
      "introductionCommit": "87e44188dbb0e54039f8b77d3613ed2728bcd51b"
    }
  }
}
